{
  "anchor_count": 106,
  "duplicate_anchors": [],
  "equation_reference_count": 4,
  "figure_reference_count": 41,
  "file_count": 7,
  "hardcoded_figure_numbers": [],
  "missing_images": [],
  "ok": true,
  "reference_count": 68,
  "schema": "realizing_emptiness.manuscript_reference_audit.v1",
  "section_reference_count": 23,
  "unknown_citations": [],
  "unresolved_references": []
}
